{
  "$schema": "https://json-schema.org/draft/2020-12/schema",
  "$id": "https://agent-playbook-template.local/docs/schemas/context-pack.schema.json",
  "title": "Context Pack Schema",
  "description": "Machine-readable, tool-agnostic context envelope for dispatching one bounded task across different agent runtimes while preserving references back to canonical repository context.",
  "type": "object",
  "additionalProperties": false,
  "required": [
    "schema_version",
    "pack_id",
    "generated_at",
    "objective",
    "role",
    "intent_mode",
    "task_scale",
    "execution_mode",
    "budget_profile",
    "approved_scope",
    "constraints",
    "source_of_truth",
    "artifacts",
    "expected_output",
    "audit"
  ],
  "properties": {
    "schema_version": {
      "type": "string",
      "description": "Version of the context-pack contract. Packs without `orchestration` may declare either \"1.0.0\" or \"1.1.0\". Packs that include `orchestration` MUST declare \"1.1.0\" (enforced by the allOf/if-then at the root).",
      "enum": [
        "1.0.0",
        "1.1.0"
      ]
    },
    "pack_id": {
      "type": "string",
      "description": "Stable identifier for this context pack instance.",
      "minLength": 1
    },
    "generated_at": {
      "type": "string",
      "format": "date-time",
      "description": "UTC timestamp at which the pack was assembled."
    },
    "objective": {
      "type": "string",
      "description": "One-sentence description of the task goal.",
      "minLength": 1
    },
    "role": {
      "type": "string",
      "description": "Conceptual role that owns this unit of work.",
      "enum": [
        "feature-planner",
        "backend-architect",
        "application-implementer",
        "ui-image-implementer",
        "integration-engineer",
        "documentation-architect",
        "risk-reviewer",
        "critic"
      ]
    },
    "intent_mode": {
      "type": "string",
      "description": "Current phase of work for the selected role.",
      "enum": [
        "analyze",
        "implement",
        "review",
        "document"
      ]
    },
    "task_scale": {
      "type": "string",
      "description": "Scale classification of the task.",
      "enum": [
        "Small",
        "Medium",
        "Large"
      ]
    },
    "execution_mode": {
      "type": "string",
      "description": "Autonomy level applied to this run.",
      "enum": [
        "supervised",
        "semi-auto",
        "autonomous"
      ]
    },
    "budget_profile": {
      "type": "string",
      "description": "Instruction loading profile used when assembling the pack.",
      "enum": [
        "nano",
        "minimal",
        "standard",
        "full"
      ]
    },
    "approved_scope": {
      "type": "object",
      "additionalProperties": false,
      "description": "Explicit scope boundaries for the receiving runtime.",
      "required": [
        "summary",
        "allowed_paths",
        "non_goals",
        "acceptance_criteria"
      ],
      "properties": {
        "summary": {
          "type": "string",
          "description": "Short natural-language summary of what is in scope.",
          "minLength": 1
        },
        "allowed_paths": {
          "type": "array",
          "description": "Files, directories, or logical modules allowed for this task.",
          "items": {
            "type": "string"
          }
        },
        "blocked_paths": {
          "type": "array",
          "description": "Paths that should not be modified unless the task is re-approved.",
          "items": {
            "type": "string"
          }
        },
        "non_goals": {
          "type": "array",
          "description": "Explicitly excluded work.",
          "items": {
            "type": "string"
          }
        },
        "acceptance_criteria": {
          "type": "array",
          "description": "Observable outcomes that define success.",
          "items": {
            "type": "string"
          }
        }
      }
    },
    "constraints": {
      "type": "array",
      "description": "Active rules, approvals, and safety boundaries the run must respect.",
      "items": {
        "type": "string"
      }
    },
    "source_of_truth": {
      "type": "object",
      "additionalProperties": false,
      "description": "Canonical repository references that outrank session memory or adapter-specific instructions.",
      "required": [
        "entrypoint_refs",
        "rules_refs",
        "playbook_refs",
        "decision_refs"
      ],
      "properties": {
        "entrypoint_refs": {
          "type": "array",
          "items": {
            "type": "string"
          },
          "description": "Root entrypoint files such as AGENTS.md."
        },
        "rules_refs": {
          "type": "array",
          "items": {
            "type": "string"
          },
          "description": "Safety and workflow rule references."
        },
        "playbook_refs": {
          "type": "array",
          "items": {
            "type": "string"
          },
          "description": "Role routing and workflow references."
        },
        "decision_refs": {
          "type": "array",
          "items": {
            "type": "string"
          },
          "description": "DECISIONS.md entries or equivalent durable decision refs."
        },
        "contract_refs": {
          "type": "array",
          "items": {
            "type": "string"
          },
          "description": "API, schema, or architecture references that are relevant to the task."
        }
      }
    },
    "artifacts": {
      "type": "object",
      "additionalProperties": false,
      "description": "Task-scoped context material supplied with the pack.",
      "required": [
        "context_files",
        "critical_context"
      ],
      "properties": {
        "context_files": {
          "type": "array",
          "description": "Relevant files or generated artifacts for this task.",
          "items": {
            "type": "object",
            "additionalProperties": false,
            "required": [
              "path",
              "kind",
              "reason",
              "required"
            ],
            "properties": {
              "path": {
                "type": "string"
              },
              "kind": {
                "type": "string",
                "enum": [
                  "doc",
                  "code",
                  "config",
                  "schema",
                  "test",
                  "decision",
                  "output",
                  "example",
                  "other"
                ]
              },
              "reason": {
                "type": "string"
              },
              "required": {
                "type": "boolean"
              }
            }
          }
        },
        "critical_context": {
          "type": "array",
          "description": "Facts that must not be dropped during compaction or adapter translation.",
          "items": {
            "type": "string"
          }
        },
        "handoff_artifact_ref": {
          "type": "string",
          "description": "Reference to a prior handoff artifact, if this pack was generated from one."
        },
        "context_anchor": {
          "type": "string",
          "description": "Current context-anchor summary for long tasks."
        },
        "summaries": {
          "type": "array",
          "description": "Operational summaries included for continuity. These are informative, not canonical.",
          "items": {
            "type": "object",
            "additionalProperties": false,
            "required": [
              "kind",
              "text"
            ],
            "properties": {
              "kind": {
                "type": "string",
                "enum": [
                  "session_compaction",
                  "review_summary",
                  "execution_summary",
                  "error_summary",
                  "other"
                ]
              },
              "text": {
                "type": "string"
              }
            }
          }
        }
      }
    },
    "project_state": {
      "type": "object",
      "additionalProperties": false,
      "description": "Optional live state facts captured at pack assembly time.",
      "properties": {
        "current_branch": {
          "type": "string"
        },
        "changed_files": {
          "type": "array",
          "items": {
            "type": "string"
          }
        },
        "validation_commands": {
          "type": "array",
          "items": {
            "type": "string"
          }
        },
        "relevant_errors": {
          "type": "array",
          "items": {
            "type": "string"
          }
        }
      }
    },
    "expected_output": {
      "type": "object",
      "additionalProperties": false,
      "description": "Required response contract for the receiving runtime.",
      "required": [
        "format",
        "success_definition",
        "validation_required"
      ],
      "properties": {
        "format": {
          "type": "string",
          "enum": [
            "plan",
            "patch",
            "review",
            "summary",
            "json",
            "markdown",
            "other"
          ]
        },
        "machine_schema_ref": {
          "type": "string",
          "description": "Optional schema reference when machine-readable output is required."
        },
        "success_definition": {
          "type": "string",
          "description": "What the adapter should treat as successful completion."
        },
        "validation_required": {
          "type": "boolean",
          "description": "Whether the runtime is expected to run validation before completion."
        },
        "response_sections": {
          "type": "array",
          "description": "Recommended sections for human-readable responses.",
          "items": {
            "type": "string"
          }
        }
      }
    },
    "audit": {
      "type": "object",
      "additionalProperties": false,
      "description": "Audit and trace metadata.",
      "required": [
        "source_marker",
        "trace_id",
        "generated_by"
      ],
      "properties": {
        "source_marker": {
          "type": "string",
          "description": "Agent or workflow source marker."
        },
        "trace_id": {
          "type": "string",
          "description": "Trace identifier shared across adapters and handoffs."
        },
        "parent_pack_id": {
          "type": "string",
          "description": "Pack ID of the immediate predecessor when chaining packs."
        },
        "context_version": {
          "type": "string",
          "description": "Version of the canonical context set used to assemble this pack."
        },
        "freshness_cutoff": {
          "type": "string",
          "format": "date-time",
          "description": "Optional timestamp limiting how stale referenced live state may be."
        },
        "generated_by": {
          "type": "string",
          "description": "Human or agent identity that assembled the pack."
        }
      }
    },
    "orchestration": {
      "type": "object",
      "additionalProperties": false,
      "description": "Optional (schema 1.1.0+) budget-aware orchestration metadata. Records how the pack was selected, ranked, truncated, and made reproducible. Adapter-neutral: the builder reads canonical repo context only (AGENTS.md, rules, project manifest, DECISIONS.md, task-declared files) and does NOT consume IDE or session state.",
      "properties": {
        "budget": {
          "type": "object",
          "additionalProperties": false,
          "description": "Token budget bookkeeping for this pack.",
          "required": [
            "profile",
            "target_total_tokens",
            "allocated"
          ],
          "properties": {
            "profile": {
              "type": "string",
              "enum": [
                "nano",
                "minimal",
                "standard",
                "full"
              ]
            },
            "target_total_tokens": {
              "type": "integer",
              "minimum": 0
            },
            "allocated": {
              "type": "object",
              "additionalProperties": {
                "type": "integer",
                "minimum": 0
              },
              "description": "Token allocation per logical section (e.g., rules, decisions, context_files, critical, reserve). Keys are free-form but should be stable across runs."
            },
            "estimate_method": {
              "type": "string",
              "description": "How the token counts were estimated (e.g., 'word_count*1.35'). Present when the builder estimates tokens itself."
            }
          }
        },
        "selection": {
          "type": "array",
          "description": "Ranked set of refs the builder chose to include. Ordered by priority ascending (1 = most important). Output ordering MUST be deterministic for identical inputs.",
          "items": {
            "type": "object",
            "additionalProperties": false,
            "required": [
              "ref",
              "priority",
              "reason"
            ],
            "properties": {
              "ref": {
                "type": "string",
                "description": "Path or logical ref that was included."
              },
              "priority": {
                "type": "integer",
                "minimum": 1,
                "description": "Lower integers are more important. Ties broken deterministically by ref."
              },
              "score": {
                "type": "number",
                "description": "Optional raw relevance score. Present when the builder used a scoring function."
              },
              "reason": {
                "type": "string",
                "description": "Short rationale so humans can audit selection."
              },
              "truncated": {
                "type": "boolean",
                "description": "True if the ref's content was summarized or cropped before inclusion."
              },
              "truncation_method": {
                "type": "string",
                "enum": [
                  "headings-only",
                  "head-tail",
                  "summary",
                  "dropped-body",
                  "none"
                ]
              }
            }
          }
        },
        "dropped": {
          "type": "array",
          "description": "Refs the builder considered but excluded. Empty when no candidates were evaluated.",
          "items": {
            "type": "object",
            "additionalProperties": false,
            "required": [
              "ref",
              "reason"
            ],
            "properties": {
              "ref": {
                "type": "string"
              },
              "reason": {
                "type": "string",
                "description": "Why the ref was not included (e.g., 'below threshold', 'budget exhausted', 'not in approved scope')."
              },
              "score": {
                "type": "number"
              }
            }
          }
        },
        "determinism": {
          "type": "object",
          "additionalProperties": false,
          "description": "Reproducibility markers. Given the same inputs, a conforming builder MUST produce identical output_hash values.",
          "required": [
            "builder_version",
            "input_hash",
            "output_hash"
          ],
          "properties": {
            "builder_version": {
              "type": "string",
              "description": "Semver of the builder that produced this pack."
            },
            "input_hash": {
              "type": "string",
              "description": "sha256 hex digest of the normalized builder inputs (args + canonical repo files read)."
            },
            "output_hash": {
              "type": "string",
              "description": "sha256 hex digest of the canonical-JSON serialization of this pack with the `output_hash` field itself replaced by an empty string."
            }
          }
        }
      }
    }
  },
  "allOf": [
    {
      "description": "If the pack carries the orchestration block, schema_version must be 1.1.0 or higher.",
      "if": {
        "required": [
          "orchestration"
        ]
      },
      "then": {
        "properties": {
          "schema_version": {
            "const": "1.1.0"
          }
        }
      }
    }
  ]
}
